{
  "schema_version": 2,
  "idempotency_key": "sha256:dc443eb3ce99e4536a930c12851390aa7ba2560282757f66192427afe68e7465",
  "memory_space_id": "workspace_01",
  "source": {
    "system": "hermes",
    "instance_id": "src_hermes_local",
    "profile_id": "default",
    "session_id": "tool_success_session",
    "round_id": "tool_success_round",
    "first_event_id": "success_user",
    "final_event_id": "success_assistant",
    "event_ids": ["success_user", "success_call", "success_result", "success_assistant"],
    "source_schema_version": 1,
    "adapter_version": "hermes-python/0.1.0"
  },
  "round": {
    "started_at": "2026-08-03T10:01:00Z",
    "completed_at": "2026-08-03T10:01:10Z",
    "events": [
      {"event_id": "success_user", "sequence": 0, "kind": "message", "role": "user", "content": [{"type": "text", "text": "Read the file."}]},
      {"event_id": "success_call", "sequence": 1, "kind": "tool_call", "tool_call_id": "call_success", "tool_name": "read_file", "arguments": {"path": "README.md"}},
      {"event_id": "success_result", "sequence": 2, "kind": "tool_result", "tool_call_id": "call_success", "status": "success", "content": [{"type": "text", "text": "file contents"}]},
      {"event_id": "success_assistant", "sequence": 3, "kind": "message", "role": "assistant", "final": true, "content": [{"type": "text", "text": "The file was read."}]}
    ]
  },
  "payload_digest": "sha256:dc443eb3ce99e4536a930c12851390aa7ba2560282757f66192427afe68e7465"
}
